{
  "$schema": "../../../studio-os/contracts/comic-issue.schema.json",
  "id": "issue-003",
  "project": "open-city",
  "status": "ready_for_review",
  "title": "Тихий режим",
  "premise": "ИИ-психолог принимает сомнение Дани за дефект и выключает тревогу вместе со способностью спрашивать о смысле.",
  "source_sync": "../../../projects/open-city/channels/studio-chat/scripts/sync-003-quiet-mode.md",
  "format": {"panels": 4, "master_aspect_ratio": "2:3", "release_targets": ["website", "telegram", "instagram"]},
  "canonical_files": {"script": "script.md", "art_master": "art/issue-003-master.png", "manifest": "manifest.json"}
}
